{
  "name": "Operations Center",
  "slug": "operations-center",
  "tagline": "Monitor and automate business operations",
  "description": "Incident management, infrastructure monitoring, security scanning, and operational automation with agents.",
  "featured_departments": [
    "ops",
    "incident",
    "security"
  ],
  "featured_commands": [
    "ops-status",
    "incident-respond",
    "security-scan",
    "ops-status",
    "incident-postmortem"
  ],
  "branding": {
    "accent_color": "#DC2626",
    "icon": "activity"
  },
  "limits": {
    "max_credits_per_mission": 5,
    "default_model": "auto"
  },
  "polar_checkout_url": null,
  "target_audience": "DevOps and SRE teams",
  "use_cases": [
    "Automated incident detection and response",
    "Infrastructure uptime monitoring",
    "Security vulnerability scanning",
    "Generate postmortems and runbooks"
  ]
}