{
  "name": "Compliance Vault",
  "slug": "compliance-vault",
  "tagline": "Automated compliance and audit management",
  "description": "Continuous compliance monitoring, audit trails, risk assessment, and regulatory reporting with agents.",
  "featured_departments": [
    "compliance",
    "audit",
    "security"
  ],
  "featured_commands": [
    "compliance-check",
    "audit-report",
    "security-scan",
    "compliance-monitor",
    "audit-trail"
  ],
  "branding": {
    "accent_color": "#1F2937",
    "icon": "shield"
  },
  "limits": {
    "max_credits_per_mission": 5,
    "default_model": "auto"
  },
  "polar_checkout_url": null,
  "target_audience": "Compliance teams and auditors",
  "use_cases": [
    "Continuous compliance monitoring and alerting",
    "Automated audit trail generation",
    "Risk assessment and mitigation tracking",
    "Regulatory reporting with analysis"
  ]
}