{
  "name": "Dev Agency",
  "slug": "dev-agency",
  "tagline": "Ship software 10x faster with agents",
  "description": "Full-stack development automation: plan, code, test, review, deploy. One command does the work of a full agency.",
  "featured_departments": [
    "engineering",
    "backend",
    "code"
  ],
  "featured_commands": [
    "cook",
    "code",
    "test",
    "review",
    "deploy"
  ],
  "branding": {
    "accent_color": "#3B82F6",
    "icon": "terminal"
  },
  "limits": {
    "max_credits_per_mission": 5,
    "default_model": "auto"
  },
  "polar_checkout_url": null,
  "target_audience": "Solo developers shipping like a full agency",
  "use_cases": [
    "Build features end-to-end with natural language",
    "Automated code review and quality gates",
    "CI/CD pipeline management and deployment",
    "Debug and fix issues with assistance"
  ]
}