{
  "name": "AI Content Studio",
  "slug": "content-studio",
  "tagline": "Create, publish, distribute content at scale",
  "description": "AI-powered content creation pipeline: blog posts, social media, email campaigns, and SEO optimization.",
  "featured_departments": ["marketing", "content", "cdp"],
  "featured_commands": [
    "marketing-campaign", "content-blog", "content-social",
    "marketing-seo", "cdp-segment"
  ],
  "branding": { "accent_color": "#F59E0B", "icon": "pen-tool" },
  "limits": { "max_credits_per_mission": 5, "default_model": "auto" },
  "polar_checkout_url": null,
  "target_audience": "Content marketers and creators",
  "use_cases": [
    "Generate blog posts optimized for SEO",
    "Create social media content calendars",
    "Build email drip campaigns with AI copywriting",
    "Analyze content performance and iterate"
  ]
}
